{
  "schemaVersion": 1,
  "generatedAt": "2026-09-28T18:20:26Z",
  "expiresAt": "2026-10-01T18:20:26Z",
  "sequence": 1,
  "signerKeyId": "plemu-manifest-dev-a",
  "entries": [
    {
      "id": "gb/libbet",
      "title": "Libbet and the Magic Floor",
      "system": "gb",
      "coreId": "sameboy",
      "minCoreVersion": "0.16.0",
      "sha256": "3607412031c8287cf878299ce96e581e85b852dde703806343b95576fa3ff1a9",
      "sizeBytes": 32768,
      "downloadUrls": [
        "https://cdn.plemu.dev/artifacts/3607412031c8287cf878299ce96e581e85b852dde703806343b95576fa3ff1a9"
      ],
      "creator": {
        "wallet": "Dos7vSEN2rFFsinucJsaLyJ8B2EhkkcyrM6zu73rjcHa",
        "displayName": "Damian Yerrick (pinobatch)"
      },
      "license": {
        "type": "custom-attested",
        "evidenceUrl": "https://github.com/pinobatch/libbet/blob/master/README.md"
      },
      "attestation": {
        "role": "curator",
        "message": "Plemu Creator Attestation v1\n\nTitle: Libbet and the Magic Floor\nSystem: gb\nSHA-256: 3607412031c8287cf878299ce96e581e85b852dde703806343b95576fa3ff1a9\nLicense: custom-attested\nStatement: I verified this work is distributed under the stated license per the linked evidence.\nWallet: Dos7vSEN2rFFsinucJsaLyJ8B2EhkkcyrM6zu73rjcHa\nTimestamp: 2026-07-13T00:00:00Z",
        "signature": "QirFFaeWXOaEuTs50KR0kHp0qboh2caJ2lS8lLlyKMklCrEfg+41QDk6shPRMzQJFUxKNJEmAfn49FjxzhLEBw==",
        "signedAt": "2026-07-13T00:00:00Z"
      },
      "artwork": {
        "screenshotUrls": []
      },
      "addedAt": "2026-09-28T18:20:26Z",
      "revoked": false,
      "tags": [
        "starter-pack",
        "gb",
        "homebrew"
      ]
    },
    {
      "id": "wasm4/hello-plemu",
      "title": "Hello Plemu",
      "system": "wasm4",
      "coreId": "wasm4",
      "minCoreVersion": "2.5.0",
      "sha256": "93a44bbb96c751218e4c00d479e4c14358122a389acca16205b1e4d0dc5f9476",
      "sizeBytes": 8,
      "downloadUrls": [
        "https://cdn.plemu.dev/artifacts/93a44bbb96c751218e4c00d479e4c14358122a389acca16205b1e4d0dc5f9476"
      ],
      "creator": {
        "wallet": "Dos7vSEN2rFFsinucJsaLyJ8B2EhkkcyrM6zu73rjcHa",
        "displayName": "Plemu Dev"
      },
      "license": {
        "type": "CC0",
        "evidenceUrl": "https://github.com/plemu-labs/plemu/blob/main/registry/beta/wasm4/hello-plemu/license-evidence/evidence.md"
      },
      "attestation": {
        "role": "creator",
        "message": "Plemu Creator Attestation v1\n\nTitle: Hello Plemu\nSystem: wasm4\nSHA-256: 93a44bbb96c751218e4c00d479e4c14358122a389acca16205b1e4d0dc5f9476\nLicense: CC0\nStatement: I created this work or have the right to distribute it under the stated license; it contains no third-party copyrighted material.\nWallet: Dos7vSEN2rFFsinucJsaLyJ8B2EhkkcyrM6zu73rjcHa\nTimestamp: 2026-07-12T00:00:00Z",
        "signature": "XOONCTgHJNOgtNz778/kv85Y0iBI/LsaW8LGvmmQpeTJPAIumAqFonWqprVNSTNNZW4FLyZRdszZnmJYrw4DDA==",
        "signedAt": "2026-07-12T00:00:00Z"
      },
      "artwork": {
        "screenshotUrls": []
      },
      "addedAt": "2026-09-28T18:20:26Z",
      "revoked": false,
      "tags": [
        "starter-pack",
        "wasm4"
      ]
    }
  ]
}
