{
  "schemaVersion": 1,
  "generatedAt": "2026-07-12T00:00:00Z",
  "expiresAt": "2030-01-01T00:00:00Z",
  "sequence": 1,
  "signerKeyId": "plemu-manifest-dev-a",
  "entries": [
    {
      "id": "gb/starforge-demo",
      "title": "Starforge Demo",
      "system": "gb",
      "coreId": "sameboy",
      "minCoreVersion": "0.16.3",
      "sha256": "70b85a30034102176c6c4f450ac3cd38ab526edb6db374fd8d94c9ea768948dd",
      "sizeBytes": 38,
      "downloadUrls": ["https://cdn.plemu.xyz/artifacts/70b85a30034102176c6c4f450ac3cd38ab526edb6db374fd8d94c9ea768948dd"],
      "creator": { "wallet": "FGUrXnKtsJaXxZwB2NwiJFx2XqH4KmBdpypqgsskcor2", "playId": null, "displayName": "dev-fixture" },
      "license": { "type": "CC0", "evidenceUrl": "https://example.com/starforge-demo", "evidenceArchiveUrl": null },
      "attestation": {
        "role": "creator",
        "message": "Plemu Creator Attestation v1\n\nTitle: Starforge Demo\nSystem: gb\nSHA-256: 70b85a30034102176c6c4f450ac3cd38ab526edb6db374fd8d94c9ea768948dd\nLicense: CC0\nStatement: I created this work or have the right to distribute it under the stated license; it contains no third-party copyrighted material.\nWallet: FGUrXnKtsJaXxZwB2NwiJFx2XqH4KmBdpypqgsskcor2\nTimestamp: 2026-07-12T00:00:00Z",
        "signature": "PLACEHOLDER-NOT-VERIFIED-BY-MANIFEST-TESTS",
        "signedAt": "2026-07-12T00:00:00Z"
      },
      "artwork": { "iconUrl": null, "screenshotUrls": [] },
      "addedAt": "2026-07-12T00:00:00Z",
      "revoked": false,
      "revokedReason": null,
      "revokedAt": null,
      "tags": ["starter-pack", "test-fixture"]
    },
    {
      "id": "tic80/revoked-example",
      "title": "Revoked Example",
      "system": "tic80",
      "coreId": "tic80",
      "minCoreVersion": "1.1.0",
      "sha256": "aaaaaaaaaaaaaaaaaaaaaaaaaaaaaaaaaaaaaaaaaaaaaaaaaaaaaaaaaaaaaaaa",
      "sizeBytes": 1024,
      "downloadUrls": ["https://cdn.plemu.xyz/artifacts/aaaaaaaaaaaaaaaaaaaaaaaaaaaaaaaaaaaaaaaaaaaaaaaaaaaaaaaaaaaaaaaa"],
      "creator": { "wallet": "FGUrXnKtsJaXxZwB2NwiJFx2XqH4KmBdpypqgsskcor2", "playId": null, "displayName": "dev-fixture" },
      "license": { "type": "MIT", "evidenceUrl": "https://example.com/revoked-example", "evidenceArchiveUrl": null },
      "attestation": {
        "role": "creator",
        "message": "Plemu Creator Attestation v1\n\nTitle: Revoked Example\nSystem: tic80\nSHA-256: aaaaaaaaaaaaaaaaaaaaaaaaaaaaaaaaaaaaaaaaaaaaaaaaaaaaaaaaaaaaaaaa\nLicense: MIT\nStatement: I created this work or have the right to distribute it under the stated license; it contains no third-party copyrighted material.\nWallet: FGUrXnKtsJaXxZwB2NwiJFx2XqH4KmBdpypqgsskcor2\nTimestamp: 2026-07-12T00:00:00Z",
        "signature": "PLACEHOLDER-NOT-VERIFIED-BY-MANIFEST-TESTS",
        "signedAt": "2026-07-12T00:00:00Z"
      },
      "artwork": { "iconUrl": null, "screenshotUrls": [] },
      "addedAt": "2026-07-12T00:00:00Z",
      "revoked": true,
      "revokedReason": "creator-request",
      "revokedAt": "2026-07-12T00:00:00Z",
      "tags": ["test-fixture"]
    }
  ]
}
